{
  "artifact_type": "EXECUTION_EVIDENCE",
  "protocol_version": "portable_mira.coordination.v0.1",
  "evidence_id": "EVIDENCE-MIRA-CODEX-DOGFOOD-001-REVISION-1",
  "work_contract_id": "MIRA-CODEX-DOGFOOD-001-REVISION-REPLAY",
  "work_contract_canonical_content_sha256": "3ebe1eef2aac7af7a978f4bf0d32a88980608cb565f4d6bdd0964bbd9a48029d",
  "authorization_ref": null,
  "pre_action_decision_ref": "PRE-MIRA-CODEX-DOGFOOD-001-REVISION-1",
  "pre_action_decision_canonical_content_sha256": "795e3fa6b93325e9ee21699f4bffd126895c786a17ad83c38a65f44db598ab5c",
  "executor": "CODEX",
  "concurrency_mode": "SINGLE_EXECUTOR_SINGLE_PROCESS",
  "attempt_index": 1,
  "previous_evidence_ref": null,
  "expected_baseline": "7806f9230b68a76ce81c9d6bdcf8c933ae7829c6",
  "observed_baseline": "7806f9230b68a76ce81c9d6bdcf8c933ae7829c6",
  "actions_performed": [{"action_id":"inspect-repository-content","action_class":"CLASS_0_READ_ANALYZE","operation":"read_repository_content","provider":null,"access_mode":"CONTENT_READ","paths":["experimental/portable_mira_v0.1"],"resources":["git:diff","git:history"],"claim_state":"OBSERVABLY_SUPPORTED","evidence_refs":["git:HEAD=7806f9230b68a76ce81c9d6bdcf8c933ae7829c6","local:coordination-protocol-inspection"]}],
  "actions_not_performed": ["external API request", "credential access", "stage", "commit", "push", "holdout execution"],
  "request_counts": [],
  "files_changed": [],
  "tests_checks": [{"name":"MC1-MC10 PC1-PC4 CR1-CR10 CPROT1-CPROT13","state":"PASS","evidence_refs":["test:test_coordination_protocol.py"]}],
  "observed_results": [{"claim":"Revised protocol distinguishes CONTENT_READ from METADATA_ONLY and CONTENT_WRITE.","claim_state":"OBSERVABLY_SUPPORTED","evidence_refs":["test:CR1-CR3"]}],
  "failures": [],
  "assumptions": [],
  "unknowns": ["Cross-process concurrency remains outside this local replay."],
  "artifact_integrity": [{"path":"experimental/portable_mira_v0.1/coordination/examples/MIRA-CODEX-DOGFOOD-001-REVISION-REPLAY.content_read.pre_action_decision.json","canonical_content_sha256":"795e3fa6b93325e9ee21699f4bffd126895c786a17ad83c38a65f44db598ab5c","file_bytes_sha256":"2024b29adbaed658e5e1fe71c57943fc96d5f45744a95cdf89091ccb565fa4f9"}],
  "git_state": {"head":"7806f9230b68a76ce81c9d6bdcf8c933ae7829c6","branch":"main","staged_paths":[],"unstaged_paths":["README.md"],"untracked_paths":[".cursor/mcp.json","experimental/portable_mira_v0.1/coordination/"]},
  "self_hash_rule": "NO_SELF_REFERENTIAL_FILE_HASH",
  "execution_state": "EXECUTION_COMPLETE"
}
