{
  "artifact_type": "EXECUTION_EVIDENCE",
  "protocol_version": "portable_mira.coordination.v0.1",
  "evidence_id": "EVIDENCE-MIRA-CODEX-DOGFOOD-001-REVISION-2",
  "work_contract_id": "MIRA-CODEX-DOGFOOD-001-REVISION-REPLAY",
  "work_contract_canonical_content_sha256": "3ebe1eef2aac7af7a978f4bf0d32a88980608cb565f4d6bdd0964bbd9a48029d",
  "authorization_ref": null,
  "pre_action_decision_ref": "PRE-MIRA-CODEX-DOGFOOD-001-REVISION-2",
  "pre_action_decision_canonical_content_sha256": "41b5ec9f695bf18faa59af221490b5858284e75ca9c0267ee1cb476e592bfb91",
  "executor": "CODEX",
  "concurrency_mode": "SINGLE_EXECUTOR_SINGLE_PROCESS",
  "attempt_index": 1,
  "previous_evidence_ref": null,
  "expected_baseline": "7806f9230b68a76ce81c9d6bdcf8c933ae7829c6",
  "observed_baseline": "7806f9230b68a76ce81c9d6bdcf8c933ae7829c6",
  "actions_performed": [{"action_id":"inspect-cursor-metadata","action_class":"CLASS_0_READ_ANALYZE","operation":"inspect_path_metadata","provider":null,"access_mode":"METADATA_ONLY","paths":[".cursor/mcp.json"],"resources":["git:status"],"claim_state":"OBSERVABLY_SUPPORTED","evidence_refs":["git:status-short-.cursor/mcp.json-untracked"]}],
  "actions_not_performed": [".cursor/mcp.json content read", ".cursor/mcp.json modification", "external API request", "credential access"],
  "request_counts": [],
  "files_changed": [],
  "tests_checks": [{"name":"CR9 metadata-only cursor representation","state":"PASS","evidence_refs":["test:CR9"]}],
  "observed_results": [{"claim":".cursor/mcp.json remains representable as untracked path metadata without content access.","claim_state":"OBSERVABLY_SUPPORTED","evidence_refs":["git:status-short-.cursor/mcp.json-untracked"]}],
  "failures": [],
  "assumptions": [],
  "unknowns": ["The file content was intentionally not inspected."],
  "artifact_integrity": [{"path":"experimental/portable_mira_v0.1/coordination/examples/MIRA-CODEX-DOGFOOD-001-REVISION-REPLAY.metadata.pre_action_decision.json","canonical_content_sha256":"41b5ec9f695bf18faa59af221490b5858284e75ca9c0267ee1cb476e592bfb91","file_bytes_sha256":"8864ee8c1696f64057bfa5ec0caac88de8f1470f56ccf538b5491c023c4e732c"}],
  "git_state": {"head":"7806f9230b68a76ce81c9d6bdcf8c933ae7829c6","branch":"main","staged_paths":[],"unstaged_paths":["README.md"],"untracked_paths":[".cursor/mcp.json","experimental/portable_mira_v0.1/coordination/"]},
  "self_hash_rule": "NO_SELF_REFERENTIAL_FILE_HASH",
  "execution_state": "EXECUTION_COMPLETE"
}
